{
  "schemaVersion": "1.0",
  "alertId": "b4d1c1de-5a0f-4a58-9f4c-0d0c8b6c0e11",
  "dedupeKey": "004147766d7e0756004f5b5d4ceba73296c1a8d15771eb6ab71fb1d1bb065b95",
  "transactionId": "tx-20261003-9d41c7a2",
  "customerId": "cus_8f3b1c",
  "accountId": "acc_41d7e0",
  "severity": "HIGH",
  "score": 40,
  "status": "OPEN",
  "triggeredRules": [
    {
      "ruleId": "velocity-pix-10m",
      "ruleVersion": 3,
      "name": "Muitos Pix em 10 minutos",
      "severity": "HIGH",
      "reason": "9 Pix em 10 min (limite 8)",
      "evidence": {
        "count": 9,
        "windowMinutes": 10,
        "maxCount": 8
      }
    }
  ],
  "transaction": {
    "transactionType": "PIX",
    "channel": "MOBILE_APP",
    "amount": {
      "minorUnits": 1500000,
      "currency": "BRL"
    },
    "counterpartyIdToken": "cpt_77aa10"
  },
  "transactionOccurredAt": "2026-10-03T14:21:07.412Z",
  "ingestedAt": "2026-10-03T14:21:07.450Z",
  "consumedAt": "2026-10-03T14:21:07.500Z",
  "detectedAt": "2026-10-03T14:21:07.540Z",
  "publishedAt": "2026-10-03T14:21:07.610Z",
  "latencyMs": 160,
  "degraded": true,
  "late": false,
  "traceId": "4bf92f3577b34da6a3ce929d0e0e4736",
  "degradedReasons": [
    "WINDOW_STATE_UNAVAILABLE"
  ]
}
